{
  "checks": [],
  "key": "v-008819",
  "modelId": "sonnet-agent",
  "promptVersion": "vendor-research.v2.md",
  "publishable": false,
  "research": {
    "confidence": "none",
    "identitySignals": [],
    "key": "v-008819",
    "notes": "individual",
    "profile": null,
    "sources": []
  },
  "researchedAt": "2026-10-02",
  "review": null
}
