{
  "checks": [],
  "key": "n-overcome",
  "modelId": "sonnet-agent",
  "promptVersion": "vendor-research.v2.md",
  "publishable": false,
  "research": {
    "confidence": "none",
    "identitySignals": [],
    "key": "n-overcome",
    "notes": "Could not find a credible candidate. Agenda gives only 'OverCOME' in Foster City, CA (a no-cost high school career-mentoring program). Searches found only unrelated organizations (The Overcome Project in Sacramento, House of Overcome in Illinois); ProPublica was rate-limited and no official website was located.",
    "profile": null,
    "sources": []
  },
  "researchedAt": "2026-10-04",
  "review": null
}
