{
  "checks": [
    {
      "detail": null,
      "field": "source:https://www.tides.org/fiscal-sponsorship/",
      "pass": true
    },
    {
      "detail": null,
      "field": "source:https://www.tides.org/contact/",
      "pass": true
    },
    {
      "detail": null,
      "field": "legalName",
      "pass": true
    },
    {
      "detail": null,
      "field": "website",
      "pass": true
    }
  ],
  "key": "n-tides-center",
  "modelId": "sonnet-agent",
  "promptVersion": "vendor-research.v2.md",
  "publishable": false,
  "research": {
    "confidence": "medium",
    "identitySignals": [
      "Name matches: tides.org lists 'Tides Center' as a legally distinct 501(c)(3) organization that offers fiscal sponsorship",
      "Tides Center's own page says it provides human resources management, payroll and benefits administration, matching OUSD's 'Staff & hiring' contract category with the Talent/Human Resources Department",
      "Agenda location (San Francisco, CA) is not confirmed by a registry or a reliable page I could fetch; no registry lookup (ProPublica, SOS, SAM.gov) succeeded, and the EIN I could find belongs to the separate Tides Foundation, so it is not used"
    ],
    "key": "n-tides-center",
    "notes": "Registry lookups failed (ProPublica rate-limited, web search budget exhausted). Tides Center is a separate legal entity from Tides Foundation (EIN 51-0198509); do not conflate. Needs a reviewer to confirm EIN, SF location and contact details from ProPublica / CA SOS.",
    "profile": {
      "address": null,
      "caEntityNumber": null,
      "ein": null,
      "email": null,
      "headquarters": null,
      "legalName": "Tides Center",
      "orgType": "nonprofit",
      "phone": null,
      "samUei": null,
      "summary": "Tides Center is a nonprofit organization, tax-exempt under Section 501(c)(3), that acts as a fiscal sponsor for social change projects. It provides finance, legal and human resources support, including payroll, benefits and grants management, so project leaders can run their work without forming their own organization.",
      "website": "https://www.tides.org"
    },
    "sources": [
      {
        "supports": [
          "summary",
          "orgType",
          "website"
        ],
        "title": "Tides Center: Fiscal Sponsorship",
        "url": "https://www.tides.org/fiscal-sponsorship/"
      },
      {
        "supports": [
          "legalName"
        ],
        "title": "Contact Tides",
        "url": "https://www.tides.org/contact/"
      }
    ]
  },
  "researchedAt": "2026-10-01",
  "review": null
}
