{
  "checks": [
    {
      "detail": null,
      "field": "source:https://gameheadsoakland.org/about/",
      "pass": true
    },
    {
      "detail": null,
      "field": "source:https://gameheadsoakland.org/",
      "pass": true
    },
    {
      "detail": null,
      "field": "website",
      "pass": true
    }
  ],
  "key": "n-gameheads",
  "modelId": "sonnet-agent",
  "promptVersion": "vendor-research.v2.md",
  "publishable": true,
  "research": {
    "confidence": "high",
    "identitySignals": [
      "Name 'Gameheads' matches an Oakland, CA youth tech-training program (gameheadsoakland.org), matching the agenda location 'Oakland, CA'",
      "Program trains young people for tech and video-game careers with mentors and industry exposure, matching OUSD's 'Workplace Training Partner' / student internship MOU through the High School Linked Learning Office",
      "Gameheads Oakland states it is a fiscally sponsored project of Community Initiatives, so it has no separate legal entity of its own on registries"
    ],
    "key": "n-gameheads",
    "notes": "Gameheads is a fiscally sponsored project of Community Initiatives, so it has no EIN or California entity number of its own; those were left null (the fiscal sponsor's EIN would not be Gameheads' own). The only email on the website is a named person's address, so it was omitted. No phone or mailing address is published on the site (the footer address on the programs page is template text). No page found names Gameheads as an OUSD partner directly; identity rests on name, Oakland location and matching youth tech-training mission.",
    "profile": {
      "address": null,
      "caEntityNumber": null,
      "ein": null,
      "email": null,
      "headquarters": "Oakland, CA",
      "legalName": null,
      "orgType": "other",
      "phone": null,
      "samUei": null,
      "summary": "Gameheads is an Oakland, California program that uses video game design and development to train young people ages 15 to 25 for careers in technology and gaming. It offers classes, mentorship, and career preparation for students, with a focus on low-income youth and youth of color. It operates as a fiscally sponsored project of the nonprofit Community Initiatives.",
      "website": "https://gameheadsoakland.org/"
    },
    "sources": [
      {
        "supports": [
          "summary",
          "orgType",
          "website",
          "headquarters"
        ],
        "title": "Gameheads : About",
        "url": "https://gameheadsoakland.org/about/"
      },
      {
        "supports": [
          "summary",
          "website"
        ],
        "title": "Gameheads Oakland",
        "url": "https://gameheadsoakland.org/"
      }
    ]
  },
  "researchedAt": "2026-10-03",
  "review": {
    "key": "n-gameheads",
    "notes": "Gameheads Oakland (gameheadsoakland.org) is an Oakland youth tech/game-design training program for ages 15-25, fiscally sponsored by Community Initiatives, which fits an OUSD workplace-training/student-internship MOU; the site does not name OUSD directly, but name, city and mission all match. Summary, orgType, website and headquarters are supported by the cited pages and the summary is neutral.",
    "sameOrganization": true,
    "unsupportedFields": [],
    "verdict": "confirmed"
  }
}
