{
  "checks": [],
  "key": "v-006438",
  "modelId": "sonnet-agent",
  "promptVersion": "vendor-research.v2.md",
  "publishable": false,
  "research": {
    "confidence": "none",
    "identitySignals": [],
    "key": "v-006438",
    "notes": "No credible candidate found. Searches returned several unrelated 'Evolution Consulting' firms (NY, PA, AZ, Marin County) but none confirmed in Santa Rosa, CA or tied to student health/family services or OUSD.",
    "profile": null,
    "sources": []
  },
  "researchedAt": "2026-10-04",
  "review": null
}
