{
  "checks": [
    {
      "detail": null,
      "field": "source:http://www.mobilityblueprint.net/",
      "pass": true
    },
    {
      "detail": null,
      "field": "website",
      "pass": true
    }
  ],
  "key": "v-009156",
  "modelId": "sonnet-agent",
  "promptVersion": "vendor-research.v2.md",
  "publishable": false,
  "research": {
    "confidence": "low",
    "identitySignals": [
      "Name matches exactly: the agenda names 'Mobility Blueprint' and the website at mobilityblueprint.net describes itself as 'Mobility Blueprint'",
      "Website describes an educational consulting company providing data and mapping tools to school districts, plausibly consistent with enrollment-department services; no page found confirming Austin, TX or Oakland Unified"
    ],
    "key": "v-009156",
    "notes": "Web search budget was exhausted, so no registry (SAM.gov, Texas/California SOS) or independent page could be checked. The company's website does not state a location, contact details, or mention Oakland Unified or Austin, TX, so identity is not confirmed beyond the name and a plausible service match. Should be re-run with search available before any publication.",
    "profile": {
      "address": null,
      "caEntityNumber": null,
      "ein": null,
      "email": null,
      "headquarters": null,
      "legalName": null,
      "orgType": "company",
      "phone": null,
      "samUei": null,
      "summary": "Mobility Blueprint describes itself as an educational consulting company. It provides mapping and data tools that help school districts use data to support student enrollment, retention and resource planning.",
      "website": "http://www.mobilityblueprint.net/"
    },
    "sources": [
      {
        "supports": [
          "summary",
          "orgType",
          "website"
        ],
        "title": "Mobility Blueprint",
        "url": "http://www.mobilityblueprint.net/"
      }
    ]
  },
  "researchedAt": "2026-10-01",
  "review": null
}
