{
  "checks": [
    {
      "detail": null,
      "field": "source:http://pjsconsultants.net/",
      "pass": true
    },
    {
      "detail": null,
      "field": "source:http://pjsconsultants.net/contact",
      "pass": true
    },
    {
      "detail": null,
      "field": "source:https://www.bizprofile.net/ca/oakland/pjs-consultants-llc",
      "pass": true
    },
    {
      "detail": null,
      "field": "email",
      "pass": true
    },
    {
      "detail": null,
      "field": "address",
      "pass": true
    },
    {
      "detail": null,
      "field": "caEntityNumber",
      "pass": true
    },
    {
      "detail": null,
      "field": "legalName",
      "pass": true
    },
    {
      "detail": null,
      "field": "website",
      "pass": true
    }
  ],
  "key": "v-003373",
  "modelId": "sonnet-agent",
  "promptVersion": "vendor-research.v2.md",
  "publishable": false,
  "research": {
    "confidence": "medium",
    "identitySignals": [
      "Name matches a California LLC 'Pjs Consultants, Llc.' (entity 201808310110) per bizprofile.net, a third-party mirror of Secretary of State filings",
      "Agenda gives Berkeley, CA and Oakland, CA; web listings show the firm at a Berkeley address earlier and an Oakland address (520 3rd Street Ste 208) as of March 2024, matching both",
      "Firm is a communications consultancy focused on Black male achievement and education funders, plausibly consistent with OUSD's Office of Equity, but no page found explicitly states a contract with OUSD"
    ],
    "key": "v-003373",
    "notes": "No public page found explicitly linking this firm to OUSD; identity rests on name, Berkeley/Oakland location and field of work. Registry details come from a third-party mirror, not bizfile directly. Reviewer should confirm before publishing.",
    "profile": {
      "address": "520 3rd Street Ste 208, Oakland, CA 94607",
      "caEntityNumber": "201808310110",
      "ein": null,
      "email": "info@pjsconsultants.net",
      "headquarters": "Oakland, CA",
      "legalName": "Pjs Consultants, Llc.",
      "orgType": "company",
      "phone": null,
      "samUei": null,
      "summary": "A small communications consulting firm based in the San Francisco Bay Area. It provides communications leadership for mission-driven organizations, including fractional chief communications officer roles, program and funder communications, and executive positioning and media preparation.",
      "website": "http://pjsconsultants.net/"
    },
    "sources": [
      {
        "supports": [
          "summary",
          "orgType",
          "website"
        ],
        "title": "PJS Consultants",
        "url": "http://pjsconsultants.net/"
      },
      {
        "supports": [
          "email"
        ],
        "title": "Contact — PJS Consultants",
        "url": "http://pjsconsultants.net/contact"
      },
      {
        "supports": [
          "legalName",
          "address",
          "headquarters",
          "caEntityNumber",
          "orgType"
        ],
        "title": "Pjs Consultants, Llc. Oakland, CA - filing information",
        "url": "https://www.bizprofile.net/ca/oakland/pjs-consultants-llc"
      }
    ]
  },
  "researchedAt": "2026-10-02",
  "review": null
}
